,issue_number,publication_date,category,title,byline,url
0,190,July 2022,FICTION,The Life and Times of the Extraterrestrial Potoo,by K. J. Khan,https://clarkesworldmagazine.com/khan_07_26
1,190,July 2022,FICTION,Focus,by Carlos Hernandez,https://clarkesworldmagazine.com/hernandez_07_26
2,190,July 2022,FICTION,Our Revels Now Are Ended,by Thomas Ha,https://clarkesworldmagazine.com/ha_07_26
3,190,July 2022,FICTION,Nesting Behavior of Imported Species Troglodytes aedon on Planet Americearth,by R.L. Meza,https://clarkesworldmagazine.com/meza_07_26
4,190,July 2022,FICTION,Cliff's Girl,by Fiona Moore,https://clarkesworldmagazine.com/moore_07_26
5,190,July 2022,FICTION,The Animator and the Glazer,"by Ju Chu, translated by S. Qiouyi Lu",https://clarkesworldmagazine.com/ju_07_26
6,190,July 2022,FICTION,This Is an Emergency Broadcast,by R.S.A. Garcia,https://clarkesworldmagazine.com/garcia_07_26
0,190,July 2022,NON-FICTION,Donut Brains and Skin Dreams: Aliens on Earth,by Gunnar De Winter,https://clarkesworldmagazine.com/de_winter_07_26
1,190,July 2022,NON-FICTION,Horror And Absurdity: A Conversation with Meg Elison,by Arley Sorg,https://clarkesworldmagazine.com/elison_interview_2026
2,190,July 2022,NON-FICTION,Art and Arcade Games: A Conversation with Tran Nguyen,by Arley Sorg,https://clarkesworldmagazine.com/nguyen_interview_2026
3,190,July 2022,NON-FICTION,Editor's Desk: July Is for Survivors,by Neil Clarke,https://clarkesworldmagazine.com/clarke_07_26
0,190,July 2022,COVER ART,Constellation Field,by Alex Vede,https://clarkesworldmagazine.com/artbio_238
